,Unnamed: 0,id,songnames,songartists,lyrics,scoringDone,anger,fear,joy,sadness,analytical,confident,tentative
127,127,23,Crazy in love,Beyonce,"[Intro: JAY-Z & Beyoncé]
Yes! So crazy right now!
Most incredibly, it's your girl, B
It's your boy, Young
You ready?

[Bridge: Beyoncé & Jay-Z]
Oh oh, oh oh, oh oh, oh no no (Oww!)
Oh oh, oh oh, oh oh, oh no no
Oh oh, oh oh, oh oh, oh no no
Oh oh, oh oh, oh oh, oh no no

[Interlude: JAY-Z]
Geah! History in the making
Part two!
It's so crazy right now

[Verse 1: Beyoncé]
I look and stare so deep in your eyes (I...)
I touch on you more and more every time
When you leave, I'm begging you not to go
Call your name, two, three times in a row
Such a funny thing for me to try to explain
How I'm feeling, and my pride is the one to blame (Yeah)
'Cause I know I don't understand
Just how your love can do what no one else can

[Chorus: Beyoncé]
Got me looking so crazy right now
Your love's got me looking so crazy right now (Your love)
Got me looking so crazy right now
Your touch got me looking so crazy right now (Your touch)
Got me hoping you'll page me right now (Hey)
Your kiss got me hoping you'll save me right now
Looking so crazy, your love's got me looking
Got me looking so crazy in love

[Bridge: Beyoncé]
Oh oh, oh oh, oh oh, oh no no
Oh oh, oh oh, oh oh, oh no no
Oh oh, oh oh, oh oh, oh no no
Oh oh, oh oh, oh oh, oh no no

[Verse 2: Beyoncé]
When I talk to my friends so quietly
(""Who he think he is?"") Look at what you did to me
Tennis shoes, don't even need to buy a new dress
If you ain't there, ain't nobody else to impress
It's the way that you know what I thought I knew
It's the beat that my heart skips when I'm with you
But I still don't understand
Just how your love can do what no one else can

[Chorus: Beyoncé & Jay-Z]
Got me looking so crazy right now
Your love's got me looking so crazy right now
(Oh, crazy, your love)
Got me looking so crazy right now (Your love)
Your touch got me looking so crazy right now (Oh, your touch)
Got me hoping you'll page me right now
Your kiss got me hoping you'll save me right now (Hey)
Looking so crazy, your love's got me looking
Got me looking so crazy in love (Geah!)
I'm looking so crazy, your love's got me looking (Woo!)
Got me looking so crazy in love
I'm warmed up now, let's go

[Verse 3: JAY-Z & (Beyoncé)]
Young Hov, y'all know when the flow is loco
Young B and the R-O-C, uh-oh (Oh)
O.G. Big Homie, the one and only (Oh, no)
Stick bony, but the pockets is fat like Tony (Oh, no)
Soprano, the ROC handle like Van Exel
I shake phonies man you can't get next to
The genuine article, I do not sing though
I sling though, if anything, I bling yo
A star like Ringo, war like a Green Beret
You crazy? Bring ya whole set
JAY-Z in the Range, crazy and deranged
They can't figure him out, they like, ""Hey, is he insane?"" (Oh, no)
Yes sir, I'm cut from a different cloth
My texture is the best fur: chinchilla
I've been iller than chain smokers
How you think I got the name Hova?
I been realer, the game's over
Fall back, Young
Ever since I made the change over to platinum
The game's been a wrap, one

[Bridge: Beyoncé]
Got me looking, so crazy, my baby
I'm not myself lately, I'm foolish, I don't do this
I've been playing myself, baby, I don't care
'Cause your love's got the best of me
And baby you're making a fool of me
You got me sprung and I don't care who sees
'Cause baby you got me, you got me
You got me, you got me so crazy, baby
Hey!

[Chorus: Beyonce]
Got me looking so crazy right now
Your love's got me looking so crazy right now (Your love)
Got me looking so crazy right now
Your touch got me looking so crazy right now (Your touch)
Got me hoping you'll page me right now
Your kiss got me hoping you'll save me right now
Looking so crazy, your love's got me looking
Got me looking so crazy in love
Got me looking so crazy right now
Your love's got me looking so crazy right now (Your love)
Got me looking so crazy right now
Your touch got me looking so crazy right now (Your touch)
Got me hoping you'll page me right now
Your kiss got me hoping you'll save me right now
Looking so crazy, your love's got me looking
Got me looking so crazy in love",1.0,0.119101,0.056566,0.644891,0.097578,0.0,0.0,0.554899
128,128,23,Immortal,Evanescence," 
I'm so tired of being here
Suppressed by all my childish fears
And if you have to leave
I wish that you would just leave
'Cause your presence still lingers here
And it won't leave me alone

[Pre-Chorus]
These wounds won't seem to heal
This pain is just too real
There's just too much that time cannot erase

 
When you cried I'd wipe away all of your tears
When you'd scream I'd fight away all of your fears
And I held your hand through all of these years
But you still have all of me

 
You used to captivate me
By your resonating light
Now I'm bound by the life you left behind
Your face it haunts
My once pleasant dreams
Your voice it chased away
All the sanity in me

[Pre-Chorus]
These wounds won't seem to heal
This pain is just too real
There's just too much that time cannot erase

 
When you cried I'd wipe away all of your tears
When you'd scream I'd fight away all of your fears
And I held your hand through all of these years
But you still have all of me

 
I've tried so hard to tell myself that you're gone
But though you're still with me
I've been alone all along

[Chorus/Outro]
When you cried I'd wipe away all of your tears
When you'd scream I'd fight away all of your fears
And I held your hand through all of these years
But you still have all of me
Ah, me, ah, me, ah",1.0,0.060172,0.454639,0.018281,0.691105,0.0,0.894028,0.0
129,129,23,The heart wants what it wants,Selena Gomez," 
What the heart wants
What the heart wants
What the heart wants (Wants, wants, wants)

 
You got me sipping on something
I can't compare to nothing I've ever known
I'm hoping that after this fever I'll survive
I know I'm acting a bit crazy
Strung out, a little bit hazy
Hand over heart, I'm praying
That I'm gonna make it out alive

[Pre-Chorus]
The bed's getting cold and you're not here
The future that we hold is so unclear
But I'm not alive until you call
And I'll bet the odds against it all
Save your advice, 'cause I won't hear
You might be right, but I don't care
There's a million reasons why I should give you up

 
But the heart wants what it wants
The heart wants what it wants

 
You got me scattered in pieces
Shining like stars and screaming
Lighting me up like Venus
But then you disappear and make me wait
And every second's like torture
Heroin drip, no more so
Finding a way to let go
Baby, baby, no, I can't escape

[Pre-Chorus]
The bed's getting cold and you're not here
The future that we hold is so unclear
But I'm not alive until you call
And I'll bet the odds against it all
Save your advice, 'cause I won't hear
You might be right, but I don't care
There's a million reasons why I should give you up

 
But the heart wants what it wants
The heart wants what it wants
The heart wants what it wants
The heart wants what it wants

 
This is a modern fairytale
No happy endings, no wind in our sails
But I can't imagine a life without
Breathless moments
Breaking me down, down, down, down

[Pre-Chorus]
The bed's getting cold and you're not here
The future that we hold is so unclear
But I'm not alive until you call
And I'll bet the odds against it all
Save your advice, 'cause I won't hear
You might be right, but I don't care
There's a million reasons why I should give you up

 
But the heart wants what it wants
The heart wants what it wants
The heart wants what it wants
The heart wants what it wants

 
The heart wants what it wants, baby
The heart wants what it wants, baby
It wants what it wants
It wants what it wants
The heart wants what it wants, baby
The heart wants what it wants, baby",1.0,0.178351,0.043466000000000005,0.728758,0.082812,0.00123,0.0,0.778831
130,130,23,Wrecking Ball,Miley Cyrus," 
We clawed, we chained, our hearts in vain
We jumped, never asking why
We kissed, I fell under your spell
A love no one could deny

[Pre-Chorus]
Don't you ever say I just walked away
I will always want you
I can't live a lie, running for my life
I will always want you

 
I came in like a wrecking ball
I never hit so hard in love
All I wanted was to break your walls
All you ever did was wreck me
Yeah, you, you wreck me

 
I put you high up in the sky
And now, you're not coming down
It slowly turned, you let me burn
And now, we're ashes on the ground

[Pre-Chorus]
Don't you ever say I just walked away
I will always want you
I can't live a lie, running for my life
I will always want you

 
I came in like a wrecking ball
I never hit so hard in love
All I wanted was to break your walls
All you ever did was wreck me
I came in like a wrecking ball
Yeah, I just closed my eyes and swung
Left me crashing in a blazing fall
All you ever did was wreck me
Yeah, you, you wreck me

 
I never meant to start a war
I just wanted you to let me in
And instead of using force
I guess I should've let you win
I never meant to start a war
I just wanted you to let me in
I guess I should've let you win

 
Don't you ever say I just walked away
I will always want you

 
I came in like a wrecking ball
I never hit so hard in love
All I wanted was to break your walls
All you ever did was wreck me
I came in like a wrecking ball
Yeah, I just closed my eyes and swung
Left me crashing in a blazing fall
All you ever did was wreck me
Yeah, you, you wreck me
Yeah, you, you wreck me

[Produced by Dr. Luke and Cirkut]
 ",1.0,0.158331,0.398547,0.007531,0.697742,0.0,0.699167,0.0
131,131,25,No time to die,billie eilish,"I should've known
I'd leave alone
Just goes to show
That the blood you bleed
Is just the blood you owe
We were a pair
But I saw you there
Too much to bear
You were my life
But life is far away from fair
Was I stupid to love you?
Was I reckless to help?
Was it obvious to everybody else
That I'd fallen for a lie?
You were never on my side
Fool me once, fool me twice
Are you death or paradise?
Now you'll never see me cry
There's just no time to die
I let it burn
You're no longer my concern
Faces from my past return
Another lesson yet to learn
That I'd fallen for a lie
You were never on my side
Fool me once, fool me twice
Are you death or paradise?
Now you'll never see me cry
There's just no time to die
No time to die
No time to die
Fool me once, fool me twice
Are you death or paradise?
Now you'll never see me cry
There's just no time to die",1.0,0.475791,0.164326,0.031099,0.719222,0.229098,0.0,0.71375
132,132,25,bellyache,billie eilish,"Sitting all alone
Mouth full of gum
In the driveway
My friends aren't far
In the back of my car
Lay their bodies

Where's my mind?
Where's my mind?

They'll be here pretty soon
Looking through my room
For the money
I'm biting my nails
I'm too young to go to jail
It's kinda funny

Where's my mind?
Where's my mind?
Where's my mind?
Where's my mind?

Maybe it's in the gutter
Where I left my lover
What an expensive fate
My V is for Vendetta
Thought that I'd feel better
But now I got a bellyache

Everything I do
The way I wear my noose
Like a necklace
I wanna make 'em scared
Like I could be anywhere
Like I'm reckless

I lost my mind
I don't mind
Where's my mind?
Where's my mind?

Maybe it's in the gutter
Where I left my lover
What an expensive fate
My V is for Vendetta
Thought that I'd feel better
But now I got a bellyache

Maybe it's in the gutter
Where I left my lover
What an expensive fate
My V is for Vendetta
Thought that I'd feel better
But now I got a bellyache",1.0,0.099036,0.468457,0.056472,0.48553,0.0,0.0,0.915164
133,133,25,call you mine,bebe rexha,"Two kids with their hearts on fire
Who's gonna save us now?
When we thought that we couldn't get higher
Things started looking down
I look at you and you look at me
Like nothing but strangers now
Two kids with their hearts on fire
Don't let it burn us out
Think about what you believe in now
Am I someone you cannot live without?
'Cause I know I don't wanna live without you, yeah
Come on, let's turn this all around
Bring it all back to that bar downtown
When you wouldn't let me walk out on you, yeah
You said, ""Hey, whatcha doing for the rest of your life?""
And I said, ""I don't even know what I'm doing tonight""
Went from one conversation to your lips on mine
And you said, ""I never regretted the day that I called you mine""
So I call you mine
Can I call you mine?
And you said, ""I never regretted the day that I called you mine""
Broke kids running through the city
Drunk on the subway train
Set free every time you kissed me
We couldn't feel no pain
You looked at me and I looked at you
Like we'd never look away
Broke kids running through the city
Don't let the memory fade
You said, ""Hey, whatcha doing for the rest of your life?""
And I said, ""I don't even know what I'm doing tonight""
Went from one conversation to your lips on mine
And you said, ""I never regretted the day that I called you mine""
So I call you mine
Can I call you mine?
And you said, ""I never regretted the day that I called you mine""
Think about what you believe in now
Am I someone you cannot live without?
'Cause I know I don't wanna live without you, yeah
Come on, let's turn this all around
Bring it all back to that bar downtown
When you wouldn't let me walk out on you, yeah
You said, ""Hey, whatcha doing for the rest of your life?""
And I said, ""I don't even know what I'm doing tonight""
Went from one conversation to your lips on mine
And you said, ""I never regretted the day that I called you mine""
So I call you mine
And you said, ""I never regretted the day that I called you mine""
Can I call you mine?
Can I call you mine?
Can I call you mine?
Can I call you mine?",1.0,0.23940100000000006,0.16636199999999998,0.12614,0.6768689999999999,0.22982600000000006,0.0,0.147506
134,134,25,dancing with a stranger,Sam Smith & Normani,"I don't wanna be alone tonight ('Lone tonight)
It's pretty clear that I'm not over you (Over you, over you)
I'm still thinking 'bout the things you do (Things you do)
So I don't want to be alone tonight, alone tonight, alone tonight
Can you light the fire? (Light the fire, light the fire)
I need somebody who can take control (Take control)
I know exactly what I need to do
'Cause I don't wanna be alone tonight, alone tonight, alone tonight

Look what you made me do, I'm with somebody new
Ooh, baby, baby, I'm dancing with a stranger
Look what you made me do, I'm with somebody new
Ooh, baby, baby, I'm dancing with a stranger
Dancing with a stranger

I wasn't even going out tonight (Out tonight)
But, boy, I need to get you off of my mind (Off of my mind)
I know exactly what I have to do
I don't wanna be alone tonight, alone tonight, alone tonight

Look what you made me do, I'm with somebody new
Ooh, baby, baby, I'm dancing with a stranger
Look what you made me do, I'm with somebody new
Ooh, baby, baby, I'm dancing with a stranger
Dancing with a stranger
Dancing with a stranger
Dancing, yeah, ooh

Look what you made me do, I'm with somebody new (Ooh)
Ooh, baby, baby, I'm dancing with a stranger
Look what you made me do, I'm with somebody new
Ooh, baby, baby, I'm dancing with a stranger
I'm dancing, I'm dancing (Ooh)
I'm dancing, I'm dancing (Dancing with a stranger)
I'm dancing, I'm dancing (Dancing with a stranger)
I'm dancing, I'm dancing (Dancing with a stranger)",1.0,0.017811,0.050459,0.629153,0.024804,0.0,0.0,0.613295
135,135,25,ocean eyes,billie eilish,"I've been watching you
For some time
Can't stop staring
At those ocean eyes
Burning cities
And napalm skies
Fifteen flares inside those ocean eyes
Your ocean eyes

No fair
You really know how to make me cry
When you gimme those ocean eyes
I'm scared
I've never fallen from quite this high
Falling into those ocean eyes
Your ocean eyes

I've been walking through
A world gone blind
Can't stop thinking of your diamond mind
Careful creature
Made friends with time
He left her lonely with a diamond mind
And those ocean eyes

No fair
You really know how to make me cry
When you gimme those ocean eyes
I'm scared
I've never fallen from quite this high
Falling into your ocean eyes
Those ocean eyes

No fair
You really know how to make me cry
When you gimme those ocean eyes
I'm scared
I've never fallen from quite this high
Falling into your ocean eyes
Those ocean eyes",1.0,0.003633,0.6778109999999999,0.196526,0.261117,0.53373,0.0,0.189197
136,136,25,i knew you were trouble,Taylor swift,"Once upon a time, a few mistakes ago
I was in your sights, you got me alone
You found me, you bound me, you bound me

I guess you didn't care and I guess I liked that
And when I fell hard, you took a step back
Without me, without me, without me

And he's long gone when he's next to me
And I realize the blame is on me

'Cause I knew you were trouble when you walked in
So shame on me now
Flew me to places I'd never been
Till you put me down
Oh, I knew you were trouble when you walked in
So shame on me now
Flew me to places I'd never been
Now I'm lying on the cold, hard ground

Oh, oh, trouble, trouble, trouble
Oh, oh, trouble, trouble, trouble

No apologies, he'll never see you cry
Pretends he doesn't know that he's the reason why
You're drowning, you're drowning, you're drowning

Now I heard you moved on from whispers on the street
A new notch in your belt is all I'll ever be
And now I see, now I see, now I see

He was long gone when he met me
And I realise the joke is on me, hey

I knew you were trouble when you walked in
So shame on me now
Flew me to places I'd never been
Till you put me down
Oh, I knew you were trouble when you walked in
So shame on me now
Flew me to places I'd never been, yeah
Now I'm lying on the cold, hard ground

Oh, oh, trouble, trouble, trouble
Oh, oh, trouble, trouble, trouble

And the saddest fear comes creeping in
That you never loved me, or her, or anyone, or anything, yeah

I knew you were trouble when you walked in
So shame on me now
Flew me to places I'd never been
Till you put me down
Oh, I knew you were trouble when you walked in (You were right there)
So shame on me now (You were right there)
Flew me to places I'd never been(Oh)
Now I'm lying on the cold, hard ground

Oh, oh, trouble, trouble, trouble
Oh, oh, trouble, trouble, trouble

I knew you were trouble when you walked in
Trouble, trouble, trouble
I knew you were trouble when you walked in
Trouble, trouble, trouble",1.0,0.192868,0.428698,0.00612,0.62132,0.0,0.0,0.081198
137,137,25,call it what you want,Taylor swift,"My castle crumbled overnight
I brought a knife to a gun fight
They took the crown but it's alright

All the liars are calling me one
Nobody's heard from me for months
I'm doing better than I ever was

'Cause my baby's fit like a daydream
Walking with his head down
I'm the one he's walking to
So call it what you want, yeah, call it what you want to

My baby's fly like a jet stream
High above the whole scene
Loves me like I'm brand new
So, call it what you want, yeah, call it what you want to

All my flowers grew back as thorns
Windows boarded up after the storm
He built a fire just to keep me warm

All the drama queens taking swings
All the jokers dressing up as kings
They fade to nothing when I look at him

And I know I make the same mistakes every time
Bridges burn, I never learn
At least I did one thing right
I did one thing right

I'm laughing with my lover
Making forts under covers
Trust him like a brother, yeah, you know I did one thing right
Starry eyes sparking up my darkest night

My baby's fit like a daydream
Walking with his head down
I'm the one he's walking to
So call it what you want, yeah, call it what you want to

My baby's fly like a jet stream
High above the whole scene
Loves me like I'm brand new
(Call it what you want, yeah, call it what you want to)
So, call it what you want, yeah, call it what you want to

I want to wear his initial
On a chain round my neck, chain round my neck
Not because he owns me
But 'cause he really knows me
(Which is more than they can say)

I recall late November
Holding my breath, slowly I said,
""You don't need to save me,
But would you run away with me?""
Yes

My baby's fit like a daydream
Walking with his head down
I'm the one he's walking to
(Call it what you want, yeah, call it what you want to)
So, call it what you want, yeah, call it what you want to

My baby's fly like a jet stream
High above the whole scene
Loves me like I'm brand new
(Call it what you want, yeah, call it what you want to)
So, call it what you want, yeah, call it what you want to

(Call it what you want, yeah, call it what you want to)
(So, call it what you want, yeah, call it what you want)
(Call it what you want to)
(Call it what you want to)
Call it what you want, yeah, call it what you want
To",1.0,0.279775,0.124954,0.531172,0.14240799999999998,0.0,0.0,0.0
138,138,25,jump,Julia Michaels,"Mmm, ah

Stay right there, get away
I need space, I told you yesterday
""Slow the pace down,"" but then I see your face
Can we do that tomorrow? (Can we do that tomorrow?)
'Cause now you're moving in on my skin
I move back with my lips
It goes against my better judgement
'Cause I, 'cause I want it, ah

And I'm gonna be cliché here for a minute
And tell you that I've been hurt before (hurt before)
So I think I'm gonna need another minute
To not hurt no more (no more)

'Cause all I do is jump right into your arms
Every time I see you, I just wrap myself around you, yeah
Jump into something real
Even though I'm cautious, I just like the way it feels
When it's us, baby, when it's us
You make me forget that I'm not ready for love
I jump, oh, I jump

Look at me being soft
Cut it all, my mind is getting lost
From your touch, I can't afford the cost
Of me losing myself to you (losing myself to you)
And I didn't want these feelings, but I brought 'em
But I know that you know exactly when I caught 'em
And I'm trying not to think about it often, but, ooh

'Cause all I do is jump right into your arms
Every time I see you, I just wrap myself around you, yeah
Jump into something real
Even though I'm cautious, I just like the way it feels
When it's us, baby, when it's us
You make me forget that I'm not ready for love
I jump, oh, I jump

Jump, jump up in this foreign
Used to sleep on couches now, the boy is really tourin'
If they sleep on me, I tell them haters, ""Go and sleep it away,"" yeah
Fell in love, but it ain't no trust
If it ain't no trust, then that girl can't be my love
'Posed to put my love above
But instead you gon' sleep it away, yeah
Like a earthquake, yeah, I'm dealing with another lil' heartbreak
Man, I wish I'd never met you in the first place
And that karma gonna get you in the worst way, yeah
Don't throw your love away, don't throw your trust away
You always run away, I wish you would fucking stay
But I guess we need another break

'Cause all I do is jump right into your arms
Every time I see you, I just wrap myself around you, yeah
Jump into something real
Even though I'm cautious, I just like the way it feels
When it's us, baby, when it's us
You make me forget that I'm not ready for love
I jump, oh, I jump
Yeah, yeah, yeah, yeah

'Cause all I do is ('cause all I do is, 'cause all I do is)
Jump
Mmm, yeah
'Cause all I do is ('cause all I do is, 'cause all I do is)
Yeah, yeah, yeah, yeah
Jump
('Cause all I do is, 'cause all I do is)
('Cause all I do is, 'cause all I do is)
Jump (jump, jump, jump)
('Cause all I do is, 'cause all I do is)
Jump (jump, jump, jump)
Jump",1.0,0.226396,0.431476,0.009675,0.6210060000000001,0.0,0.5987979999999999,0.0
139,139,25,this feeling,Chainsmokers,"[Verse 1: Kelsea Ballerini]
I'll tell you a story before it tells itself
I'll lay out all my reasons, you'll say that I need help
We all got expectations, and sometimes they go wrong
But no one listens to me, so I put it in this song

[Pre-Chorus: Kelsea Ballerini]
They tell me think with my head, not that thing in my chest
They got their hands at my neck this time
But you're the one that I want, and if that's really so wrong
Then they don't know what this feeling is like

[Chorus: Kelsea Ballerini & Andrew Taggart]
And I say yeah-eah, yeah-eah-eah-eah
Yeah-eah, yeah-eah-eah-eah
And I say yeah-eah, yeah-eah-eah-eah
Yeah-eah, yeah-eah-eah-eah

[Verse 2: Andrew Taggart]
I'll tell them a story, they'll sit and nod their heads
I tell you all my secrets, and you tell all your friends
Hold on to your opinions, and stand by what you said (Stand by what you said)
In the end, it's my decision, so it's my fault when it ends

[Pre-Chorus: Kelsea Ballerini & Andrew Taggart]
They tell me think with my head, not that thing in my chest
They got their hands at my neck this time
But you're the one that I want, and if that's really so wrong
Then they don't know what this feeling is like

[Chorus: Andrew Taggart]
And I say yeah-eah, yeah-eah-eah-eah
Yeah-eah, yeah-eah-eah-eah
And I say yeah-eah, yeah-eah-eah-eah
Yeah-eah, yeah-eah-eah-eah

[Verse 3: Kelsea Ballerini & Andrew Taggart]
I'll tell you a story before it tells itself
I'll lay out all my reasons, you'll say that I need help
We all got expectations, and sometimes they go wrong
But no one listens to me, so I put it in this song

[Pre-Chorus: Kelsea Ballerini & Andrew Taggart]
They tell me think with my head, not that thing in my chest
They got their hands at my neck this time
But you're the one that I want, and if that's really so wrong
Then they don't know what this feeling is like

[Bridge: Kelsea Ballerini & Andrew Taggart]
My friends say no-o, no-o-o (But they don't know)
No-o, no-o-o
Yeah, no-o, no-o-o
They don't know, no no (No-o, no-o-o)

[Outro: Andrew Taggart & Kelsea Ballerini]
And I say yeah, oh oh
Oh, and I say yeah, hey-ey, yeah
They don't know, oh",1.0,0.026605,0.028552,0.02756,0.122333,0.0,0.459067,0.0
