,Unnamed: 0,id,songnames,songartists,lyrics,scoringDone,anger,fear,joy,sadness,analytical,confident,tentative
232,232,42,just_give_me_a_reason,pink,"[Verse 1: P!nk]
Right from the start
You were a thief you stole my heart
And I your willing victim
I let you see the parts of me
That weren't all that pretty
And with every touch you fixed them
Now you've been talking in your sleep
Oh, oh
Things you never say to me
Oh, oh
Tell me that you've had enough
Of our love, our love

[Chorus: P!nk]
Just give me a reason
Just a little bit's enough
Just a second - we're not broken, just bent
And we can learn to love again
It's in the stars
It's been written in the scars on our hearts
We're not broken, just bent
And we can learn to love again

[Verse 2: Nate Ruess & P!nk & both]
I'm sorry I don't understand where all of this is coming from
I thought that we were fine
(Oh we had everything)
Your head is running wild again
My dear we still have everything
And it's all in your mind
(Yeah but this is happening)
Now you've been having real bad dreams
Oh, oh
You used to lie so close to me
Oh, oh
There's nothing more than empty sheets
Between our love, our love
Oh, our love, our love, love

[Chorus: Nate Ruess & both]
Just give me a reason
Just a little bit’s enough
Just a second - we’re not broken, just bent
And we can learn to love again
I’ve never stopped
You’re still written in the scars on my heart
You’re not broken, just bent
And we can learn to love again

[Bridge: Nate Ruess & P!nk]
Oh, tears ducts and rust
I'll fix it for us
We're collecting dust but our love's enough
You're holding it in
You're pouring a drink
No nothing is as bad as it seems
We'll come clean

[Chorus: Both]
Just give me a reason
Just a little bit's enough
Just a second we're not broken just bent
And we can learn to love again
It's in the stars
It's been written in the scars on our hearts
That we're not broken just bent
And we can learn to love again

[Chorus: Both]
Just give me a reason
Just a little bit's enough
Just a second we're not broken just bent
And we can learn to love again
It's in the stars
It's still written in the scars on our hearts
That we're not broken just bent
And we can learn to love again

[Outro: P!nk]
Oh, we can learn to love again
Oh, we can learn to love again
Oh
That we're not broken just bent
And we can learn to love again",1.0,0.015622,0.020809,0.4986020000000001,0.004063000000000001,0.0,0.0,0.88023
233,233,42,i_hate_you_i_love_you,gnash,"[Verse 1: Olivia O'Brien]
Feeling used, but I'm
Still missing you and I can't
See the end of this
Just wanna feel your kiss against my lips
And now all this time is passing by
But I still can't seem to tell you why
It hurts me every time I see you
Realize how much I need you

[Chorus: Olivia O'Brien]
I hate you, I love you
I hate that I love you
Don't want to, but I can't put
Nobody else above you
I hate you, I love you
I hate that I want you
You want her, you need her
And I'll never be her

[Verse 2: gnash]
I miss you when I can't sleep
Or right after coffee or right when I can't eat
I miss you in my front seat
Still got sand in my sweaters
From nights we don't remember
Do you miss me like I miss you?
Fucked around and got attached to you
Friends can break your heart, too
And I'm always tired, but never of you
If I pulled a you on you, you wouldn't like that shit
I put this reel out, but you wouldn't bite that shit
I type a text, but then I never mind that shit
I got these feelings, but you never mind that shit
Oh oh, keep it on the low
You're still in love with me, but your friends don't know
If you wanted me, you would just say so
And if I were you, I would never let me go

[Chorus: Olivia O'Brien]
I hate you, I love you
I hate that I love you
Don't want to, but I can't put
Nobody else above you
I hate you, I love you
I hate that I want you
You want her, you need her
And I'll never be her

[Verse 3: gnash]
I don't mean no harm, I just miss you on my arm
Wedding bells were just alarms
Caution tape around my heart
You ever wonder what we could have been?
You said you wouldn't and you fucking did
Lie to me, lie with me, get your fucking fix
Now all my drinks and all my feelings are all fucking mixed
Always missing people that I shouldn't be missing
Sometimes you gotta burn some bridges just to create some distance
I know that I control my thoughts and I should stop reminiscing
But I learned from my dad that it's good to have feelings
When love and trust are gone
I guess this is moving on
Everyone I do right does me wrong
So every lonely night, I sing this song

[Chorus: Olivia O'Brien  with gnash]
I hate you, I love you
I hate that I love you
Don't want to, but I can't put
Nobody else above you
I hate you, I love you
I hate that I want you
You want her, you need her
And I'll never be her

[Bridge: Olivia O'Brien with gnash]
All alone, I watch you watch her
Like she's the only girl you've ever seen
You don't care, you never did
You don't give a damn about me
Yeah, all alone, I watch you watch her
She is the only thing you've ever seen
How is it you never notice
That you are slowly killing me?

[Chorus: Olivia O'Brien]
I hate you, I love you
I hate that I love you
Don't want to, but I can't put
Nobody else above you
I hate you, I love you
I hate that I want you
You want her, you need her
And I'll never be her",1.0,0.438513,0.293657,0.001476,0.566449,0.0,0.0,0.062352
234,234,42,yellow,coldplay,"[Verse 1: Chris Martin]
Look at the stars
Look how they shine for you
And everything you do
Yeah, they were all yellow
I came along
I wrote a song for you
And all the things you do
And it was called ""Yellow""
So then I took my turn
Oh, what a thing to have done
And it was all yellow

[Chorus 1: Chris, Jonny & Will]
(Aah) Your skin, oh yeah, your skin and bones
(Ooh) Turn into something beautiful
(Aah) You know, you know I love you so
You know I love you so

[Verse 2: Chris Martin]
I swam across
I jumped across for you
Oh, what a thing to do
'Cause you were all yellow
I drew a line
I drew a line for you
Oh, what a thing to do
And it was all yellow

[Chorus 2: Chris, Jonny & Will]
(Aah) Your skin, oh yeah, your skin and bones
(Ooh) Turn into something beautiful
(Aah) And you know
For you, I'd bleed myself dry
For you, I'd bleed myself dry

[Bridge: Chris Martin]
It's true, look how they shine for you
Look how they shine for you
Look how they shine for
Look how they shine for you
Look how they shine for you
Look how they shine

[Outro: Chris Martin]
Look at the stars
Look how they shine for you
And all the things that you do",1.0,0.000851,0.007836,0.406714,0.011881999999999998,0.0,0.782551,0.0
235,235,42,senorita,camila_cabello,"[Chorus: Camila Cabello]
I love it when you call me señorita
I wish I could pretend I didn't need ya
But every touch is ooh-la-la-la
It's true, la-la-la
Ooh, I should be runnin'
Ooh, you keep me coming for ya

[Verse 1: Shawn Mendes]
Land in Miami
The air was hot from summer rain
Sweat drippin' off me
Before I even knew her name, la-la-la
It felt like ooh-la-la-la, yeah, no
Sapphire moonlight
We danced for hours in the sand
Tequila Sunrise
Her body fit right in my hands, la-la-la
It felt like ooh-la-la-la, yeah

[Chorus: Camila Cabello & Shawn Mendes, Camila Cabello]
I love it when you call me señorita
I wish I could pretend I didn't need ya
But every touch is ooh-la-la-la
It's true, la-la-la
Ooh, I should be runnin'
Ooh, you know I love it when you call me señorita
I wish it wasn't so damn hard to leave ya
But every touch is ooh-la-la-la
It's true, la-la-la
Ooh, I should be runnin'
Ooh, you keep me coming for ya

[Verse 2: Camila Cabello with Shawn Mendes]
Locked in the hotel
There's just some things that never change
You say we're just friends
But friends don't know the way you taste, la-la-la (La, la, la)
'Cause you know it's been a long time coming
Don't ya let me fall, oh
Ooh, when your lips undress me, hooked on your tongue
Ooh, love, your kiss is deadly, don't stop

[Chorus: Both, Camila Cabello & Shawn Mendes]
I love it when you call me señorita
I wish I could pretend I didn't need ya
But every touch is ooh-la-la-la
It's true, la-la-la
Ooh, I should be runnin'
Ooh, you know I love it when you call me señorita
I wish it wasn't so damn hard to leave ya (So damn hard to leave ya)
But every touch is ooh-la-la-la
It's true, la-la-la (True la-la)
Ooh, I should be runnin'
Ooh, you keep me coming for ya

[Outro: Both, Shawn Mendes & Camila Cabello]
All along, I've been coming for ya (For you)
And I hope it meant something to you (Oh)
Call my name, I'll be coming for ya (Coming for you)
Coming for ya (Coming for you)
For ya
For ya (Oh, she loves it when I call)
For ya
Ooh, I should be runnin'
Ooh, you keep me coming for ya",1.0,0.006018,0.009346,0.060069,0.022266,0.0,0.0,0.082004
236,236,42,don't_let_me_down,chainsmokers," 
Crashing, hit a wall
Right now I need a miracle
Hurry up now, I need a miracle
Stranded, reaching out
I call your name, but you're not around
I say your name, but you're not around

 
I need you, I need you, I need you right now
Yeah, I need you right now
So don't let me, don't let me, don't let me down
I think I'm losing my mind now
It's in my head, darling, I hope
That you'll be here when I need you the most
So don't let me, don't let me, don't let me down
D-don't let me down
Don't let me down

[Post-Chorus]
Don't let me down, down, down
Don't let me down
Don't let me down, down, down

 
R-r-running out of time
I really thought you were on my side
But now there's nobody by my side

 
I need you, I need you, I need you right now
Yeah, I need you right now
So don't let me, don't let me, don't let me down
I think I'm losing my mind now
It's in my head, darling, I hope
That you'll be here when I need you the most
So don't let me, don't let me, don't let me down
D-don't let me down
Don't let me down

[Post-Chorus]
Don't let me down, down, down
Don't let me down, down, down
Don't let me down, down, down
Don't let me down
Don't let me down, down, down

 
Ooh, I think I'm losing my mind now, yeah
Ooh, I think I'm losing my mind now, yeah

 
I need you, I need you, I need you right now
Yeah, I need you right now
So don't let me, don't let me, don't let me down
I think I'm losing my mind now
It's in my head, darling, I hope
That you'll be here when I need you the most
So don't let me, don't let me, don't let me down
Don't let me down

 
Yeah, don't let me down
Yeah, don't let me down
Don't let me down, oh, no
Say don't let me down
Don't let me down, no-o
Don't let me down
Don't let me down, down, down",1.0,0.264542,0.418513,0.04931,0.5208659999999999,0.0,0.0,0.616216
237,237,43,Hall of Fame,The Script,"[Verse 1: Danny O'Donoghue & will.i.am]
Yeah, you can be the greatest, you can be the best
You can be the King Kong bangin' on your chest
You can beat the world, you can beat the war
You can talk to God, go bangin' on his door
You can throw your hands up, you can beat the clock (Yeah)
You can move a mountain, you can break rocks
You can be a master, don’t wait for luck
Dedicate yourself and you gon' find yourself

[Chorus: Danny O'Donoghue & will.i.am]
Standin' in the Hall of Fame (Yeah)
And the world’s gonna know your name (Yeah)
‘Cause you burn with the brightest flame (Yeah)
And the world’s gonna know your name (Yeah)
And you’ll be on the walls of the Hall of Fame

[Verse 2: Danny O'Donoghue & will.i.am]
You can go the distance, you can run the mile
You can walk straight through hell with a smile
You can be the hero, you can get the gold
Breakin' all the records they thought never could be broke, yeah
Do it for your people, do it for your pride
How are you ever gonna know if you never even try?
Do it for your country, do it for your name
‘Cause there's gon' be a day, when you're

[Chorus: Danny O'Donoghue & will.i.am]
Standin' in the Hall of Fame (Yeah)
And the world’s gonna know your name (Yeah)
‘Cause you burn with the brightest flame (Yeah)
And the world’s gonna know your name (Yeah)
And you’ll be on the walls of the Hall of Fame

[Post-Chorus: will.i.am]
Be a champion
Be a champion
Be a champion
Be a champion
And you’ll be on the walls of the Hall of Fame

[Bridge: Danny O'Donoghue]
Be students, be teachers
Be politicians, be preachers
Yeah
Be believers, be leaders
Be astronauts, be champions
Be truth-seekers
Be students, be teachers
Be politicians, be preachers
Yeah
Be believers, be leaders
Be astronauts, be champions

[Chorus: Danny O'Donoghue & will.i.am]
Standin' in the Hall of Fame (Yeah)
And the world’s gonna know your name (Yeah)
‘Cause you burn with the brightest flame (Yeah)
And the world’s gonna know your name (Yeah)
And you’ll be on the walls of the Hall of Fame

[Outro: Danny O'Donoghue & will.i.am]
You can be the greatest, you can be the best
(Be a champion)
You can be the King Kong bangin' on your chest
(You can be a champion)
You can beat the world, you can beat the war
(Be a champion)
You can talk to God, go bangin' on his door
(You can be a champion)
You can throw your hands up, you can beat the clock
(You can be a champion)
You can move a mountain, you can break rocks
(You can be a champion)
You can be a master, don’t wait for luck
(You can be a champion)
Dedicate yourself and you gon' find yourself
(You can be a champion)
Standing in the Hall of Fame…",1.0,0.002098,0.000583,0.293887,0.000135,0.0,0.0,0.132101
238,238,43,Mockingbird,Eminem," 
Yeah, I know sometimes things may not always make sense to you right now. But hey, what'd Daddy always tell you? Straighten up, little soldier, stiffen up that upper lip! What you cryin' about? You got me

 
Hailie, I know you miss your mom, and I know you miss your dad
When I'm gone, but I'm tryin' to give you the life that I never had
I can see you're sad, even when you smile, even when you laugh
I can see it in your eyes, deep inside you wanna cry
'Cause you're scared, I ain't there
Daddy's with you in your prayers
No more cryin', wipe them tears
Daddy's here, no more nightmares
We gon' pull together through it
We gon' do it, Lainie—Uncle's crazy, ain't he?
Yeah, but he loves you, girl, and you better know it
We're all we got in this world, when it spins, when it swirls
When it whirls, when it twirls, two little beautiful girls
Lookin' puzzled, in a daze, I know it's confusin' you
Daddy's always on the move, Momma's always on the news
I try to keep you sheltered from it, but somehow it seems
The harder that I try to do that, the more it backfires on me
All the things growin' up as Daddy that he had to see
Daddy don't want you to see, but you see just as much as he did
We did not plan it to be this way, your mother and me
But things have got so bad between us, I don't see us ever bein'
Together ever again, like we used to be when we was teenagers
But then, of course, everything always happens for a reason
I guess it was never meant to be, but it's just something
We have no control over, and that's what destiny is
But no more worries, rest your head and go to sleep
Maybe one day we'll wake up and this'll all just be a dream

 
Now hush, little baby, don't you cry
Everything's gonna be alright
Stiffen that upper lip up, little lady, I told ya
Daddy's here to hold ya through the night
I know Mommy's not here right now, and we don't know why
We fear how we feel inside
It may seem a little crazy, pretty baby
But I promise, Momma's gon' be alright (heh)

 
It's funny, I remember back one year when Daddy had no money
Mommy wrapped the Christmas presents up and stuck 'em under the tree
And said some of 'em were from me 'cause Daddy couldn't buy 'em
I'll never forget that Christmas, I sat up the whole night cryin'
'Cause Daddy felt like a bum—see, Daddy had a job
But his job was to keep the food on the table for you and Mom
And at the time, every house that we lived in
Either kept gettin' broken into and robbed or shot up on the block
And your mom was savin' money for you in a jar
Tryin' to start a piggy bank for you so you could go to college
Almost had a thousand dollars, 'til someone broke in and stole it
And I know it hurt so bad it broke your momma's heart
And it seemed like everything was just startin' to fall apart
Mom and Dad was arguin' a lot, so Momma moved back
On to Chalmers in the flat, one bedroom apartment
And Dad moved back to the other side of 8 Mile on Novara
And that's when Daddy went to California with his CD
And met Dr. Dre and flew you and Momma out to see me
But Daddy had to work, you and Momma had to leave me
Then you started seein' Daddy on the TV, and Momma didn't like it
And you and Lainie were too young to understand it
Papa was a rolling stone, Momma developed a habit
And it all happened too fast for either one of us to grab it
I'm just sorry you were there and had to witness it first hand
'Cause all I ever wanted to do was just make you proud
Now I'm sittin' in this empty house
Just reminiscin', lookin' at your baby pictures, it just trips me out
To see how much you both have grown, it's almost like you're sisters now
Wow, guess you pretty much are, and Daddy's still here
Lainie, I'm talkin' to you too, Daddy's still here
I like the sound of that, yeah, it's got a ring to it, don't it?
Sshh! Momma's only gone for the moment

 
Now hush, little baby, don't you cry
Everything's gonna be alright
Stiffen that upper lip up, little lady, I told ya
Daddy's here to hold ya through the night
I know Mommy's not here right now, and we don't know why
We fear how we feel inside
It may seem a little crazy, pretty baby
But I promise, Momma's gon' be alright

 
And if you ask me to, Daddy's gonna buy you a mockingbird
I'ma give you the world
I'ma buy a diamond ring for you, I'ma sing for you
I'll do anything for you to see you smile
And if that mockingbird don't sing and that ring don't shine
I'ma break that birdie's neck
I'll go back to the jeweler who sold it to ya
And make him eat every carat, don't fuck with Dad! (Ha-ha!)",1.0,0.104218,0.155999,0.5309699999999999,0.6377229999999999,0.0,0.0,0.730234
239,239,43,Iron,Woodkid,"[Verse 1: Woodkid]
Deep in the ocean, dead and cast away
Where innocence is burned, in flames
A million miles from home, I'm walking ahead
I'm frozen to the bones, I am

A soldier on my own, I don't know the way
I'm riding up the heights, of shame
I'm waiting for the call, the hand on the chest
I'm ready for the fight, and fate

 
The sound of iron shots is stuck in my head
The thunder of the drums, dictates
The rhythm of the falls, the number of deaths
The rising of the horns, ahead

From the dawn of time to the end of days
I will have to run, away
I want to feel the pain and the bitter taste
Of the blood on my lips, again

 
This deadly burst of snow is burning my hands
I'm frozen to the bones, I am
A million miles from home, I'm walking away
I can't remind your eyes, your face",1.0,0.114368,0.535582,0.009931,0.567948,0.064038,0.108589,0.0
240,240,43,Piano Man,Billy Joel," 
It's nine o'clock on a Saturday
The regular crowd shuffles in
There's an old man sitting next to me
Making love to his tonic and gin

He says, ""Son, can you play me a memory?
I'm not really sure how it goes
But it's sad and it's sweet and I knew it complete
When I wore a younger man's clothes.""

[Pre-Chorus]
La la la, di da da
La la, di da da da dum

 
Sing us a song, you're the piano man
Sing us a song tonight
Well, we're all in the mood for a melody
And you've got us feeling alright

 
Now John at the bar is a friend of mine
He gets me my drinks for free
And he's quick with a joke or to light up your smoke
But there's someplace that he'd rather be
He says, ""Bill, I believe this is killing me.""
As the smile ran away from his face
""Well I'm sure that I could be a movie star
If I could get out of this place""

[Pre-Chorus]
La la la, di da da
La la, di da da da dum

 
Now Paul is a real estate novelist
Who never had time for a wife
And he's talkin' with Davy, who's still in the Navy
And probably will be for life

And the waitress is practicing politics
As the businessmen slowly get stoned
Yes, they're sharing a drink they call loneliness
But it's better than drinkin' alone

 
Sing us a song, you're the piano man
Sing us a song tonight
Well, we're all in the mood for a melody
And you've got us feeling alright

 
It's a pretty good crowd for a Saturday
And the manager gives me a smile
'Cause he knows that it's me they've been comin' to see
To forget about life for a while
And the piano, it sounds like a carnival
And the microphone smells like a beer
And they sit at the bar and put bread in my jar
And say, ""Man, what are you doin' here?""

[Pre-Chorus]
La la la, di da da
La la, di da da da dum

 
Sing us a song, you're the piano man
Sing us a song tonight
Well, we're all in the mood for a melody
And you've got us feeling alright",1.0,0.052144,0.00073,0.719594,0.207576,0.0,0.0,0.295233
241,241,43,The Spectre,Alan Walker," 
Hello, hello, can you hear me as I scream your name?
Hello, hello, do you need me before I fade away?

 
Is this the place that I call home
To find what I've become?
Walk along the path unknown
We live, we love, we lie
Deep in the dark I don't need the light
There's a ghost inside me
It all belongs to the other side
We live, we love, we lie (We live, we love, we lie)

 
Hello, hello, nice to meet you, voice inside my head
Hello, hello, I believe you, how can I forget?

 
Is this the place that I call home
To find what I've become?
Walk along the path unknown
We live, we love, we lie
Deep in the dark, I don't need the light
There's a ghost inside me
It all belongs to the other side
We live, we love, we lie (We live, we love, we lie)
We live, we love, we lie",1.0,0.188701,0.172728,0.593106,0.58787,0.20928,0.0,0.189197
242,242,43,King,Lauren Aquilina," 
You're alone, you're on your own, so what?
Have you gone blind?
Have you forgotten what you have and what is yours?
Glass half empty, glass half full
Well, either way, you won't be going thirsty
Count your blessings, not your flaws

 
You've got it all
You lost your mind in the sound
There's so much more
You can reclaim your crown
You're in control
Rid of the monsters inside your head
Put all your faults to bed
You can be king again

 
You don't get what all this is about
You're too wrapped up in your self-doubt
You've got that young blood, set it free

 
You've got it all
You lost your mind in the sound
There's so much more
You can reclaim your crown
You're in control
Rid of the monsters inside your head
Put all your faults to bed
You can be king

 
There's method in my madness
There's no logic in your sadness
You don't gain a single thing from misery
Take it from me

 
You've got it all
You lost your mind in the sound
There's so much more
You can reclaim your crown
You're in control
Rid of the monsters inside your head
Put all your faults to bed
You can be king

 
You've got it all
You lost your mind in the sound
There's so much more
You can reclaim your crown
You're in control
Rid of the monsters inside your head
Put all your faults to bed
You can be king again",1.0,0.7101430000000001,0.115706,0.031134,0.271216,0.0,0.8831610000000001,0.0
