,Unnamed: 0,id,songnames,songartists,lyrics,scoringDone,anger,fear,joy,sadness,analytical,confident,tentative
356,356,62,Poker face,lady gaga," 
Mum mum mum mah
Mum mum mum mah
Mum mum mum mah
Mum mum mum mah
Mum mum mum mah

 
I wanna hold 'em like they do in Texas, please
Fold 'em, let 'em hit me, raise it; baby, stay with me (I love it)
Love game intuition, play the cards with spades to start
And after he's been hooked, I'll play the one that's on his heart

[Pre-Chorus]
Oh, oh-oh, oh, oh
Oh oh oh oh, oh oh
I'll get him hot, show him what I've got
Oh, oh-oh, oh, oh
Oh oh oh oh, oh oh
I'll get him hot, show him what I've got

 
Can't read my, can't read my
No, he can't read my poker face
(She’s got me like nobody)
Can't read my, can't read my
No, he can't read my poker face
(She’s got me like nobody)

[Post-Chorus]
Po-po-po-poker face, po-po-fuck her face
(Mum mum mum mah)
Po-po-po-poker face, po-po-fuck her face
(Mum mum mum mah)

 
I wanna roll with him, a hard pair we will be
A little gambling is fun when you're with me (I love it)
Russian roulette is not the same without a gun
And baby, when it's love, if it's not rough, it isn't fun (fun)

[Pre-Chorus]
Oh, oh-oh, oh, oh
Oh oh oh oh, oh oh
I'll get him hot, show him what I've got
Oh, oh-oh, oh, oh
Oh oh oh oh, oh oh
I'll get him hot, show him what I've got

 
Can't read my, can't read my
No, he can't read my poker face
(She’s got me like nobody)
Can't read my, can't read my
No, he can't read my poker face
(She’s got me like nobody)

[Post-Chorus]
Po-po-po-poker face, po-po-fuck her face
(Mum mum mum mah)
Po-po-po-poker face, po-po-fuck her face
(Mum mum mum mah)
(Mum mum mum mah)
(Mum mum mum mah)

 
I won't tell you that I love you
Kiss or hug you
'Cause I'm bluffin' with my muffin
I'm not lying, I'm just stunnin' with my love-glue-gunnin'
Just like a chick in the casino
Take your bank before I pay you out
I promise this, promise this
Check this hand 'cause I'm marvelous

 
Can't read my, can't read my
No, he can't read my poker face
(She’s got me like nobody)
Can't read my, can't read my
No, he can't read my poker face
(She’s got me like nobody)
Can't read my, can't read my
No, he can't read my poker face
(She’s got me like nobody)
Can't read my, can't read my
No, he can't read my poker face
(She’s got me like nobody)
Can't read my, can't read my
No, he can't read my poker face
(She’s got me like nobody)
Can't read my, can't read my
No, he can't read my poker face
(She’s got me like nobody)

[Post-Chorus]
Po-po-po-poker face, po-po-fuck her face
Po-po-po-poker face, po-po-fuck her face
(She’s got me like nobody)
Po-po-po-poker face, po-po-fuck her face
(Mum mum mum mah)
Po-po-po-poker face, po-po-fuck her face
(Mum mum mum mah)
Po-po-po-poker face, po-po-fuck her face
(Mum mum mum mah)
Po-po-po-poker face, po-po-fuck her face
(Mum mum mum mah)",1.0,0.002329,0.004951,0.057218,0.0049,0.0,0.0,0.594001
357,357,62,Beautiful day,U2," 
The heart is a bloom, shoots up through the stoney ground
There's no room, no space to rent in this town
You're out of luck, and the reason that you had to care
The traffic is stuck, and you're not moving anywhere
You thought you'd found a friend to take you out of this place
Someone you could lend a hand in return for grace

 
It's a beautiful day
Sky falls, you feel like
It's a beautiful day
Don't let it get away

 
You're on the road, but you've got no destination
You're in the mud, in the maze of her imagination
You love this town even if that doesn't ring true
You've been all over, and it's been all over you

 
It's a beautiful day
Don't let it get away
It's a beautiful day
Ooh-hoo-hoo

 
Touch me
Take me to that other place
Teach me
I know I'm not a hopeless case

 
See the world in green and blue
See China right in front of you
See the canyons broken by cloud
See the tuna fleets clearing the sea out
See the Bedouin fires at night
See the oil fields at first light
And see the bird with a leaf in her mouth
After the flood all the colours came out

 
It's a beautiful day
Don't let it get away
Beautiful day

 
Touch me
Take me to that other place
Reach me
I know I'm not a hopeless case

 
What you don't have you don't need it now
What you don't know you can feel it somehow
What you don't have you don't need it now
Don't need it now
Was a beautiful day",1.0,0.201841,0.008261,0.725109,0.056642999999999985,0.0041270000000000005,0.0,0.211602
358,358,62,Yellow,Coldplay,"[Verse 1: Chris Martin]
Look at the stars
Look how they shine for you
And everything you do
Yeah, they were all yellow
I came along
I wrote a song for you
And all the things you do
And it was called ""Yellow""
So then I took my turn
Oh, what a thing to have done
And it was all yellow

[Chorus 1: Chris, Jonny & Will]
(Aah) Your skin, oh yeah, your skin and bones
(Ooh) Turn into something beautiful
(Aah) You know, you know I love you so
You know I love you so

[Verse 2: Chris Martin]
I swam across
I jumped across for you
Oh, what a thing to do
'Cause you were all yellow
I drew a line
I drew a line for you
Oh, what a thing to do
And it was all yellow

[Chorus 2: Chris, Jonny & Will]
(Aah) Your skin, oh yeah, your skin and bones
(Ooh) Turn into something beautiful
(Aah) And you know
For you, I'd bleed myself dry
For you, I'd bleed myself dry

[Bridge: Chris Martin]
It's true, look how they shine for you
Look how they shine for you
Look how they shine for
Look how they shine for you
Look how they shine for you
Look how they shine

[Outro: Chris Martin]
Look at the stars
Look how they shine for you
And all the things that you do",1.0,0.000851,0.007836,0.406714,0.011881999999999998,0.0,0.782551,0.0
359,359,62,Hot in herre,nelly," 
It's hot in... so hot in herre! So hot in... hot - OH!

 
With a little bit of, uh uh; and a little bit of, uh uh
Just a little bit of...  just a little bit of...
Just a little bit of...  just a little bit of...

[Verse 1: Nelly]
I was like, good gracious - ass is bodacious (uhh)
Flirtacious, tryin to show patience
I'm waitin for the right time to shoot my steez (you know)
Waitin for the right time to flash them keys, then uhh
I'm leavin, please believe in - ohhh!
Me and the rest of my heathens
Check it, got it locked at the top of the Fo' Seasons
Penthouse, roof top, birds I'm feedin
No deceivin, nuttin up my sleeve and
No teasin.. I need you to
Get up up on the dance floor
Give that man what he askin for
Cause I feel like bustin loose
And I feel like touchin you, uh uh
And can't nobody stop the juice
So baby tell me what's the use? I said

 
It's gettin hot in herre (so hot), so take off all your clothes
I am - gettin so hot, I wanna take my clothes off
It's gettin hot in herre (so hot), so take off all your clothes
I am - gettin so hot, I wanna take my clothes off

Uh, uh, uh - let it hang alll out!

[Verse 2: Nelly]
Why you at the bar if you ain't poppin the bottles? (c'mon)
What good is all the fame if you ain't fuckin the models
I see you drivin, sports cars, ain't hittin the throttle
And I'll be down to do a hundred, top down and goggles
Got off the freeway, exit 106 and parked it
Ash tray, flip gate, time to spark it
Gucci collar for dollar, got out and walked it
I spit game cause baby I can't talk it
Warm, sweatin, it's hot up in this joint
Vokal tanktop, on at this point
You with a winner so baby you can't lose
I got secrets can't leave Cancun
So take it off like you're home alone
You know dance in front your mirror while you're on the phone
Checkin your reflection and tellin your best friend
Like ""Girl I think my butt gettin big!""

 
It's gettin hot in herre (so hot), so take off all your clothes
I am - gettin so hot, I wanna take my clothes off
It's gettin hot in herre (so hot), so take off all your clothes
I am - gettin so hot, I wanna take my clothes off

Uh, uh, uh - let it hang alll out!

 
(Let it hang all out)
Mix a little bit of ah, ah
With a little bit of ah, ah
(Let it just fall out)
Give a little bit of ah, ah
With a little bit of ah, ah
(Let it hang all out)
With a little bit of ah, ah
And a sprinkle of that ah, ah
(Let it just fall out)
I like it when ya ah, ah
Girl, baby make it ah, ah

[Verse 3: Nelly]
Stop pacin, time wastin
I got a friend with a pole in the basement (what?)
I'm just kidding like Jason (oh)
Unless you gon' do it
Extra, extra - eh, spread the news (check it)
Nelly took a trip from the Lou' to the Neptunes
Came back with somethin thicker than fittin in Sasoons
Say she got a thing about cuttin in restrooms - ohhhhh!

 
It's gettin hot in here (so hot), so take off all your clothes
I am - gettin so hot, I wanna take my clothes off
It's gettin hot in here (so hot), so take off all your clothes
I am - gettin so hot, I wanna take my clothes off

Uh, uh, uh - let it hang alll out!
It's gettin hot in herre (so hot), so take off all your clothes
I am - gettin so hot, I wanna take my clothes off
It's gettin hot in herre (so hot), so take off all your clothes
I am - gettin so hot, I wanna take my clothes off

Uh, uh, uh - let it hang alll out!

 
(Let it hang all out)
Mix a little bit of ah, ah
With a little bit of ah, ah
(Let it just fall out)
Give a little bit of ah, ah
With a little bit of ah, ah
(Let it hang all out)
With a little bit of ah, ah
And a sprinkle of that ah, ah
(Let it just fall out)
I like it when ya ah, ah
Girl, baby make it ah, ah... ohhh!",1.0,0.728604,0.150646,0.167043,0.440513,0.0,0.028344,0.0
360,360,62,Paper planes,M.I.A," 
I fly like paper, get high like planes
If you catch me at the border I got visas in my name
If you come around here, I make 'em all day
I get one done in a second if you wait
I fly like paper, get high like planes
If you catch me at the border I got visas in my name
If you come around here, I make 'em all day
I get one done in a second if you wait
Sometimes I think sittin' on trains
Every stop I get to I'm clocking that game
Everyone's a winner, we're making our fame
Bona fide hustler making my name
Sometimes I think sittin' on trains
Every stop I get to I'm clocking that game
Everyone's a winner, we're making our fame
Bona fide hustler making my name

 
All I wanna do is–, and a–
And take your money
All I wanna do is–, and a–
And take your money
All I wanna do is–, and a–
And take your money
All I wanna do is–, and a–
And take your money

 
Pirate skulls and bones
Sticks and stones and weed and bongs
Running when we hit 'em
Lethal poison for the system
Pirate skulls and bones
Sticks and stones and weed and bongs
Running when we hit 'em
Lethal poison for the system
No one on the corner has swagger like us
Hit me on my burner prepaid wireless
We pack and deliver like UPS trucks
Already going hard, just pumping that gas
No one on the corner has swagger like us
Hit me on my burner prepaid wireless
We pack and deliver like UPS trucks
Already going hard, just pumping that gas

 
All I wanna do is–, and a–
And take your money
All I wanna do is–, and a–
And take your money
All I wanna do is–, and a–
And take your money
All I wanna do is–, and a–
And take your money

 
M.I.A, third world democracy
Yeah, I've got more records than the KGB
So, uh, no funny business (Are you ready all?)
Some some some I some I murder
Some I some I let go
Some some some I some I murder
Some I some I let go

 
All I wanna do is–, and a–
And take your money
All I wanna do is–, and a–
And take your money
All I wanna do is–, and a–
And take your money
All I wanna do is–, and a–
And take your money",1.0,0.459338,0.35178200000000004,0.006846,0.407977,0.0,0.0,0.417263
361,361,62,Let me love you,Mario," 
Mmmm, ah
Mmmm, yeah
Mmmm
Yeah, yeah, yeah
Mmmm, ah
Mmmm, yeah
Mmmm
Yeah, yeah

 
Baby, I just don't get it, do you enjoy being hurt?
I know you smelled the perfume, the make-up on his shirt
You don't believe his stories, you know that they're all lies
Bad as you are, you stick around and I just don't know why

[Pre-Chorus]
If I was ya' man, baby, you'd...
Never worry 'bout what I do
I'd be coming home, back to you, every night, doing you right
You're the type of woman who deserves good things
Fistful of diamonds, a hand full of rings
Baby, you're a star, I just wanna show you you are

 
You should let me love you
Let me be the one to
Give you everything you want and need
Baby, good love and protection
Make me your selection
Show you the way love's supposed to be
Baby, you should let me love you, love you, love you
Love you
Yeah, listen

 
Your true beauty’s description; looks so good that it hurts
You're a dime, plus 99, and it's a shame
Don't even know what you're worth
Everywhere you go, they stop and stare, 'cause you're bad and it shows
From your head to your toes, out of control
Baby, you know

[Pre-Chorus]
If I was ya' man, baby, you'd...
Never worry 'bout what I do
I'd be coming home, back to you, every night, doing you right
You're the type of woman who deserves good things
Fistful of diamonds, a hand full of rings
Baby, you're a star, I just wanna show you you are

 
You should let me love you
Let me be the one to
Give you everything you want and need
Ooh baby, good love and protection
Make me your selection
Show you the way love's supposed to be
Baby, you should let me

 
You deserve better, girl (Oh, you know you deserve better)
We should be together, girl (Baby)
With me and you, it's whatever girl, hey
So can we make this thing ours?

 
You should let me love you
Let me be the one to (Let me be the one to give)
Give you everything you want and need (Everything you need)
Baby, good love and protection (Said everything)
Make me your selection (Will you take me, baby?)
Show you the way love's supposed to be (Oh)
Baby, you should let me love you
Let me be the one to
Give you everything you want and need (Give you everything)
That good love and protection
Make me your selection
Show you the way love's supposed to be (Hey)
You should let me love you (Love you)
Let me be the one to give you everything you want and need
(The one to, everything you need)
Good love and protection (Protection)
Make me your selection (Selection, baby)
Show you the way love's supposed to be, yeah (Oh)
Let me love you
That's all you need, baby",1.0,0.04316,0.005823,0.438065,0.008005,0.0,0.0,0.459516
362,362,63,Dire Straits,Brothers in arms,"[Instrumental Intro 0;00-1:06]

 
These mist covered mountains
Are a home now for me
But my home is the lowlands
And always will be
Some day you'll return to
Your valleys and your farms
And you'll no longer burn
To be brothers in arms

 
Through these fields of destruction
Baptisms of fire
I've witnessed your suffering
As the battle raged high
And though they did hurt me so bad
In the fear and alarm
You did not desert me
My brothers in arms

 
There's so many different worlds
So many different suns
And we have just one world
But we live in different ones

 

 
Now the sun's gone to hell
And the moon's riding high
Let me bid you farewell
Every man has to die
But it's written in the starlight
And every line in your palm
We're fools to make war
On our brothers in arms

[Instrumental Outro 4:48-6:59]",1.0,0.396995,0.488582,0.026646,0.376161,0.0,0.644211,0.0
363,363,63,Pink Floyd,Shine on you crazy diamond,"[Part 1 (0:00-3:53): Instrumental]

[Part 2 (3:53-6:26): Instrumental]

[Part 3 (6:26-8:40): Instrumental]

[Part 4 (8:40-11:08)]

[Verse 1: Roger Waters]
Remember when you were young
You shone like the Sun

[Refrain: Roger Waters & David Gilmour]
Shine on, you crazy diamond

[Verse 2: Roger Waters]
Now there's a look in your eyes
Like black holes in the sky

[Refrain: Roger Waters & David Gilmour]
Shine on, you crazy diamond

[Chorus 1: Roger Waters]
You were caught in the crossfire of childhood and stardom
Blown on the steel breeze
Come on, you target for faraway laughter
Come on, you stranger, you legend, you martyr, and shine

[Verse 3: Roger Waters]
You reached for the secret too soon
You cried for the Moon

[Refrain: Roger Waters & David Gilmour]
Shine on, you crazy diamond

[Verse 4: Roger Waters]
Threatened by shadows at night
And exposed in the light

[Refrain: Roger Waters & David Gilmour]
Shine on (Shine on), you crazy diamond (You crazy diamond)

[Chorus 2: Roger Waters]
Well, you wore out your welcome with random precision
Rode on the steel breeze
Come on, you raver, you seer of visions
Come on, you painter, you piper, you prisoner, and shine

[Part 5 (11:08-13:32): Instrumental]",1.0,2e-05,0.002764,0.075438,0.015119,0.324507,0.0,0.33545
364,364,63,Pink Floyd,Echoes," 

[Verse 1: David Gilmour & Richard Wright]
Overhead the albatross hangs motionless upon the air
And deep beneath the rolling waves in labyrinths of coral caves
The echo of a distant time comes willowing across the sand
And everything is green and submarine

[Chorus 1: David Gilmour & Richard Wright]
And no one showed us to the land
And no one knows the where's or why's
But something stirs and something tries
And starts to climb towards the light

[Verse 2: David Gilmour & Richard Wright]
Strangers passing in the street
By chance two separate glances meet
And I am you
And what I see is me
And do I take you by the hand
And lead you through the land
And help me understand the best I can?

[Chorus 2: David Gilmour & Richard Wright]
And no one calls us to move on
And no one forces down our eyes
No one speaks and no one tries
No one flies around the sun

[4:56 - 19:11 - Instrumental]

[Verse 3: David Gilmour & Richard Wright]
Cloudless every day you fall
Upon my waking eyes
Inviting and inciting me to rise
And through the window in the wall
Come streaming in on sunlight wings
A million bright ambassadors of morning

[Chorus 3: David Gilmour & Richard Wright]
And no one sings me lullabies
And no one makes me close my eyes
So I throw the windows wide
And call to you across the sky

 ",1.0,0.006581,0.022525,0.213302,0.02797,0.003472,0.0,0.6510279999999999
365,365,63,Pink Floyd,Cymbaline," 
The path you tread is narrow and the drop is shear and very high
The ravens all are watching from a vantage point nearby
Apprehension creeping like a tube-train up your spine
Will the tightrope reach the end? Will the final couplet rhyme?

 
And it’s high time, Cymbaline
It’s high time, Cymbaline
Please, wake me

 
A butterfly with broken wings is falling by your side
The ravens all are closing in, there’s nowhere you can hide
Your manager and agent are both busy on the phone
Selling coloured photographs to magazines back home

 
And it’s high time, Cymbaline
It’s high time, Cymbaline
Please, wake me

 
The lines converging where you stand
They must have moved the picture plane
The leaves are heavy around your feet
You hear the thunder of the train
And suddenly it strikes you that they’re moving into range
And Doctor Strange is always changing size

 
And it’s high time! (high time), Cymbaline
It’s high time, Cymbaline
Please, wake me

 
And it’s high time, Cymbaline
It’s high time, Cymbaline
Please, wake me",1.0,0.52671,0.397831,0.077827,0.22979,0.044229,0.742379,0.0
366,366,63,The doors,The end," 

 
This is the end
Beautiful friend
This is the end
My only friend, the end

 
Of our elaborate plans, the end
Of everything that stands, the end
No safety or surprise, the end
I'll never look into your eyes again

 
Can you picture what will be?
So limitless and free
Desperately in need
Of some stranger's hand
In a desperate land

 
Lost in a Roman wilderness of pain
And all the children are insane
All the children are insane
Waiting for the summer rain, yeah

 
There's danger on the edge of town
Ride the King's Highway, baby
Weird scenes inside the gold mine
Ride the highway west, baby
Ride the snake, ride the snake
To the lake, the ancient lake, baby
The snake, he's long, seven miles
Ride the snake
He's old and his skin is cold
The west is the best
The west is the best
Get here and we'll do the rest
The blue bus is calling us
The blue bus is calling us
Driver, where you taking us?

 
The killer awoke before dawn
He put his boots on
He took a face from the ancient gallery
And he walked on down the hall
He went into the room where his sister lived, and then he
Paid a visit to his brother, and then he
He walked on down the hall, and
And he came to a door
And he looked inside
""Father?"" ""Yes, son?"" ""I want to kill you""
""Mother? I want to...""

 
Come on baby, take a chance with us
Come on baby, take a chance with us
Come on baby, take a chance with us
And meet me at the back of the blue bus
Of the blue bus, on the blue bus, on the blue bus
Come on yeah
Fuck, fuck
Fuck fuck, fuck, fuck
Come on baby, fuck me baby yeah
Fuck fuck fuck fuck fuck
Come on baby, fuck me baby
Fuck fuck fuck fuck fuck
Come on
Fuck fuck
Alright
Fuck fuck
Kill, kill, kill, kill

 
This is the end
Beautiful friend
This is the end
My only friend, the end

 
It hurts to set you free
But you'll never follow me
The end of laughter and soft lies
The end of nights we tried to die
This is the end",1.0,0.775384,0.06154,0.030599,0.13842100000000002,0.0,0.0,0.206429
367,367,63,The doors,Riders on the storm," 
Riders on the storm
Riders on the storm
Into this house we're born
Into this world we're thrown
Like a dog without a bone, an actor out on loan
Riders on the storm

 
There's a killer on the road
His brain is squirmin' like a toad
Take a long holiday
Let your children play
If you give this man a ride, sweet family will die
Killer on the road

 
Girl you gotta love your man
Girl you gotta love your man
Take him by the hand
Make him understand
The world on you depends, our life will never end
Gotta love your man

 
Riders on the storm
Riders on the storm
Into this house we're born
Into this world we're thrown
Like a dog without a bone, an actor out on loan
Riders on the storm

 
Riders on the storm
Riders on the storm
Riders on the storm
Riders on the storm",1.0,0.204833,0.027443,0.660803,0.07824500000000001,0.0,0.0,0.459516
368,368,63,Radiohead,Daydreaming," 
Dreamers
They never learn
They never learn
Beyond the point
Of no return
Of no return
Then it's too late
The damage is done
The damage is done

 
This goes
Beyond me
Beyond you
A white room
By a window
Where the sun comes
Through
We are
Just happy to serve
Just happy to serve
You

 
​efil ym fo flaH
​efil ym fo flaH
​efil ym fo flaH
​efil ym fo flaH
​efil ym fo flaH
​efil ym fo flaH
​efil ym fo flaH
​efil ym fo flaH
​efil ym fo flaH
​efil ym fo flaH
​efil ym fo flaH
​efil ym fo flaH
​efil ym fo flaH
​efil ym fo flaH
​efil ym fo flaH
​efil ym fo flaH​​",1.0,0.145545,0.02146,0.697498,0.070385,0.0,0.0,0.281044
369,369,63,Made in heights,Death," 
Feel it rush like a hush in the attic, bae
You could see me blush when I tell you all about it
In a moment hit the switch, then a moment in the dark
Then a moment so pervasive it was breaking us apart
The galaxy is spreading like a rumor in your jaw
Better keep your planet spinning better keep the motive tall
There’s time inside my tears making diamonds on the wall
Heavy forest summer night, I confess that I'm a lightweight
Cause fate is rolling up and hate is blowing up
If it’s a crime to bend the line then we should tear it up
And when the waters start to cross, I'll call you up
I genuinely love to hear your thoughts
Inherited these ways and they came with seven claws
Like the terror that remains every morning in the dark
And the tethers that you lace only tie you in a knot
Don’t fall for all the blame, don’t rely on the applause

 
Tripping for so long, I've been tripping for so long
Tripping for so long, I've been tripping for so long

 
Your burden was the weight of a feather
I was certain if I waited you’d remember
When the comet took me out into space
When you held your breath, looking at my face
Now I comprehend that death is not the end
And the world that we destroyed wasn't real enough to live in
But I’m alive, yes I'm alive
I can feel it running up and down my spine

  (x2)
Tripping for so long, I've been tripping for so long
Tripping for so long, I've been tripping for so long
Tripping for so long, I've been tripping for so long
Tripping for so long, I've been tripping for so long",1.0,0.17318,0.277441,0.06565399999999999,0.696445,0.0,0.0,0.001613
370,370,63,Made in heights,Panther," 
Feel you get closer now
Closer than you've been
But I need you in my arms, my eyes, my soul
My sunlit skies
Yeah, I need you in my arms now
Closer than you've been
I need you in my life, my eyes, my soul
My sunlit skies

 
Just a quick wick, summer flame, burnin' in the glass
Gotta dig down low to stay lit
Crazy can't stay long and you wanna move fast but
Good things take wit
Gimme your devotion, baby
And we'll set the charms that thrill me so good
Feel the race of our hearts strip the paint from the cars
Steady as we move
Don't got money on my mind, go and search my thoughts
Only green on my riverbanks
Throw my pennies on your line to fill you up
Pour my love down to make it rain

[Pre-Chorus]
'Cause I need you in my arms, my eyes, my soul
My sunlit skies
Yeah, I need you in my arms (Ooh, oh-oh-oh)

 
Feel you get closer now
Much closer than you've been
But I need you in my arms, my eyes, my soul
My sunlit skies
Yeah, I need you in my arms now
Closer than you've been
I need you in my life, my eyes, my soul
My sunlit skies

 

 
Got nobody on my mind, go and search my thoughts
Only you on my riverbanks
Throw my hours on your line, no need to rush
Pour my love down to make it rain

[Pre-Chorus]
'Cause I need you in my arms, my eyes, my soul
My sunlit skies
Yeah, I need you in my arms (Ooh, ooh-oh-oh)

 
Feel you get closer now
Much closer than you've been
But I need you in my arms, my eyes, my soul
My sunlit skies
Yeah, I need you in my arms now
Closer than you've been
I need you in my life, my eyes, my soul
My sunlit skies
I need you in my arms",1.0,0.042264,0.174974,0.562608,0.290538,0.0,0.0,0.311722
